{
  "$schema": "https://json-schema.org/draft/2020-12/schema",
  "title": "TechnicalLeadTask",
  "type": "object",
  "required": [
    "task_id",
    "objective",
    "acceptance_criteria",
    "owner",
    "risk_level",
    "constraints",
    "approval_required"
  ],
  "properties": {
    "task_id": { "type": "string", "minLength": 1 },
    "objective": { "type": "string", "minLength": 1 },
    "acceptance_criteria": {
      "type": "array",
      "minItems": 1,
      "items": { "type": "string", "minLength": 1 }
    },
    "owner": { "type": "string", "minLength": 1 },
    "risk_level": { "enum": ["low", "medium", "high", "critical"] },
    "constraints": { "type": "array", "items": { "type": "string" } },
    "dependencies": {
      "type": "array",
      "items": {
        "type": "object",
        "required": ["name", "owner"],
        "properties": {
          "name": { "type": "string" },
          "owner": { "type": "string" },
          "fallback": { "type": "string" },
          "escalation_trigger": { "type": "string" }
        }
      }
    },
    "approval_required": { "type": "boolean" },
    "verification_plan": { "type": "array", "items": { "type": "string" } },
    "rollback": { "type": "string" }
  },
  "additionalProperties": true
}
