{"task_id":"TL-104","objective":"Add idempotent retry support to payment webhook processing without duplicate side effects","acceptance_criteria":["Duplicate webhook delivery does not create duplicate business effects","Transient downstream failures are retried within bounded policy","Permanent failures are observable and recoverable"],"owner":"backend-workstream","risk_level":"high","constraints":["Preserve current public webhook contract","No destructive production action"],"dependencies":[{"name":"payment-event-store","owner":"platform","fallback":"retain existing processing path behind flag","escalation_trigger":"schema support unavailable before integration checkpoint"}],"approval_required":false,"verification_plan":["unit tests for idempotency key behavior","integration test duplicate delivery","failure-path telemetry review"],"rollback":"disable new retry path using feature flag"}